Product URL,Product Title,Product Price,MRP Price,Discount Percentage,Best Sellers Rank,Date First Available,Packer,Importer,ASIN,Customer Reviews,Number of Rating,Item Weight,Item Dimensions,Net Quantity,Generic Name,Brand,Model,Capacity Litres,Installation Type,Special Features,Oven Cooking Mode,Colour,Voltage,Wattage,Material,Included Components,Country of Origin
https://www.amazon.in/sspa/click?ie=UTF8&spc=MTo0MDk0Njg2NTcxMDM0Njc6MTY4NjQ5NzAxNTpzcF9hdGZfYnJvd3NlOjIwMTIyMzU3OTA4MDk4OjowOjo&url=%2FSamsung-Convection-Microwave-CE1041DSB3-TL%2Fdp%2FB09VH1Q7CM%2Fref%3Dsr_1_1_sspa%3Fqid%3D1686497015%26s%3Dkitchen%26sr%3D1-1-spons%26sp_csd%3Dd2lkZ2V0TmFtZT1zcF9hdGZfYnJvd3Nl%26psc%3D1,"Samsung 28 L Convection Microwave Oven (CE1041DSB3/TL, Black, SlimFry)",12390,16990,27,"#4,031 in Home & Kitchen (See Top 100 in Home & Kitchen)  #7 in Microwave Ovens",14-03-2022,Email: support.india@samsung.com Tel (Toll Free): 1800 40 7267864 (1800 40 SAMSUNG),Email: support.india@samsung.com Tel (Toll Free): 1800 40 7267864 (1800 40 SAMSUNG),B09VH1Q7CM,4.4,7758,17 kg 500 g,47.5 x 51.7 x 31 Centimeters,1 Case,Convection Microwave Oven,Samsung,CE1041DSB3/TL,28,Freestanding,Defrost,"Grill, Microwave, Convection",Black,230 Volts,900 Watts,"Cavity : Ceramic Enamel Cavity, Door : Glass, Body : Stainless Steel","Glass Turntable, Wire Rack, Crusty Plate, Quick Guide Label",Malaysia
https://www.amazon.in/Whirlpool-MAGICOOK-PRO-20SE-BLACK/dp/B07YWYGJYD/ref=sr_1_2?qid=1686497015&s=kitchen&sr=1-2,Whirlpool 20 L Solo Microwave Oven (MAGICOOK PRO 20SE BLACK),5920,8755,32,"#1,615 in Home & Kitchen (See Top 100 in Home & Kitchen)  #1 in Microwave Ovens",13-12-2019,Whirlpool,"Whirlpool of India Ltd. Plot No. A-4, MIDC Ranjangaon,Taluka Shirur, Dist: Pune, Maharashtra 412220, India, Email - helpdeskindia@whirlpool.com ; Toll Free - 1800 208 1800",B07YWYGJYD,4.1,1564,2 kg 650 g,177.2 x 103.1 x 137.8 Centimeters,1 set,Microwave Ovens,Whirlpool,MAGICOOK PRO 20SE BLACK,20,Countertop,Autocook,Solo,Black,230 Volts,800 Watts,Iron,1,China
https://www.amazon.in/Panasonic-Microwave-NN-ST26JMFDG-Silver-Menus/dp/B08CL8XF75/ref=sr_1_3?qid=1686497015&s=kitchen&sr=1-3,"Panasonic 20L Solo Microwave Oven (NN-ST26JMFDG, Silver, 51 Auto Menus)",5890,7490,21,"#1,711 in Home & Kitchen (See Top 100 in Home & Kitchen)  #2 in Microwave Ovens",08-07-2020,Panasonic,Panasonic,B08CL8XF75,4.4,4335,10 kg 500 g,44.3 x 34 x 25.8 Centimeters,1 count,Microwave Ovens,Panasonic,NN-ST26JMFDG,20,Countertop,"Oven Safe, Auto Cook, Defrost, Turntable",Solo,Silver,230 Volts,800 Watts,Iron,"MWO Unit, Turntable, Rotating Ring, User Manual",Thailand
https://www.amazon.in/IFB-Microwave-25PM2S-IFBJ0-Silver/dp/B085V1JD27/ref=sr_1_4?qid=1686497015&s=kitchen&sr=1-4,"IFB 25 L Solo Microwave Oven (25PM2S, Silver)",7090,8990,21,"#2,366 in Home & Kitchen (See Top 100 in Home & Kitchen)  #3 in Microwave Ovens",12-03-2020,"IFB Industries Ltd.L-1, Verna, Goa, India-403722 0832-3044800/01 Customerservice@ifbglobal.com","IFB Industries Ltd.L-1, Verna, Goa, India-403722 0832-3044800/01 Customerservice@ifbglobal.com",B085V1JD27,4.3,892,13 kg 400 g,41.5 x 48.3 x 28.1 Centimeters,1 Count,Microwave Ovens,IFB,25PM2S,25,Freestanding,"61 Auto-cook menus, Disinfect, Deodorize, Timer option, Power Save, Overheating Protection, Sensor Malfunction Protection",Solo,Silver,230 Volts,50,Stainless Steel,"1 Microwave Oven, Warranty Card and User Manual",null
https://www.amazon.in/Samsung-Convection-Microwave-MC28A5013AK-TL/dp/B09XBMXQ34/ref=sr_1_5?qid=1686497015&s=kitchen&sr=1-5,"Samsung 28 L Convection Microwave Oven (MC28A5013AK/TL, Black, Curd Anytime)",11590,15590,26,"#3,537 in Home & Kitchen (See Top 100 in Home & Kitchen)  #6 in Microwave Ovens",06-04-2022,Email: support.india@samsung.com Tel (Toll Free): 1800 40 7267864 (1800 40 SAMSUNG),Email: support.india@samsung.com Tel (Toll Free): 1800 40 7267864 (1800 40 SAMSUNG),B09XBMXQ34,4.3,3654,17 kg 500 g,47.5 x 51.7 x 31 Centimeters,1 Case,Convection Microwave Oven,Samsung,MC28A5013AK/TL,28,Freestanding,Defrost,"Grill, Microwave, Convection",Black,230 Volts,900 Watts,Body : Stainless Steel,"Glass Turntable, Wire Rack, Quick Guide Label",Malaysia
https://www.amazon.in/Samsung-Convection-Microwave-CE1041DSB3-TL/dp/B09VH1Q7CM/ref=sr_1_6?qid=1686497015&s=kitchen&sr=1-6,"Samsung 28 L Convection Microwave Oven (CE1041DSB3/TL, Black, SlimFry)",12390,16990,27,"#4,031 in Home & Kitchen (See Top 100 in Home & Kitchen)  #7 in Microwave Ovens",14-03-2022,Email: support.india@samsung.com Tel (Toll Free): 1800 40 7267864 (1800 40 SAMSUNG),Email: support.india@samsung.com Tel (Toll Free): 1800 40 7267864 (1800 40 SAMSUNG),B09VH1Q7CM,4.4,7758,17 kg 500 g,47.5 x 51.7 x 31 Centimeters,1 Case,Convection Microwave Oven,Samsung,CE1041DSB3/TL,28,Freestanding,Defrost,"Grill, Microwave, Convection",Black,230 Volts,900 Watts,"Cavity : Ceramic Enamel Cavity, Door : Glass, Body : Stainless Steel","Glass Turntable, Wire Rack, Crusty Plate, Quick Guide Label",Malaysia
https://www.amazon.in/Panasonic-Solo-Microwave-NN-SM25JBFDG-Black/dp/B08DYCWC9R/ref=sr_1_7?qid=1686497015&s=kitchen&sr=1-7,"Panasonic 20L Solo Microwave Oven (NN-SM25JBFDG,Black)",5490,6790,19,"#5,230 in Home & Kitchen (See Top 100 in Home & Kitchen)  #2 in Solo Microwaves",30-07-2020,"Panasonic India Private Limited,12th Floor, Ambience Tower, Ambience Island, NH-8, Gurgaon -122002, Haryana","Panasonic India Private Limited,12th Floor, Ambience Tower, Ambience Island, NH-8, Gurgaon -122002, Haryana",B08DYCWC9R,4.4,2565,10 kg 500 g,44 x 34 x 26 Centimeters,1 count,Microwave Ovens,Panasonic,NN-SM25JBFDG,20,Countertop,Autocook,Solo,Black,230 Volts,800 Watts,Stainless Steel,"User Manual, Warranty Card",Thailand
https://www.amazon.in/LG-Solo-Microwave-MS2043DB-Black/dp/B00M52J2QY/ref=sr_1_8?qid=1686497015&s=kitchen&sr=1-8,"LG 20 L Solo Microwave Oven (MS2043DB, Black)",6949,8799,21,"#2,507 in Home & Kitchen (See Top 100 in Home & Kitchen)  #1 in Solo Microwaves",26-07-2014,LG,LG,B00M52J2QY,4.3,2095,2 kg 710 g,179.1 x 99.2 x 126 Centimeters,1 set,Microwave Oven,LG,MS2043DB,20,Countertop,"Programmable, Programmable, Autocook, Controlpanellock, Defrost, Interiorlight, Self-cleaning, Timer, Turntable",Solo,Black,70 Volts,700 Watts,Others,1,null
https://www.amazon.in/IFB-Litre-Microwave-20PM-MEC2-White/dp/B09HMGHFB6/ref=sr_1_9?qid=1686497015&s=kitchen&sr=1-9,IFB 20 Litre Solo Microwave Oven (20PM-MEC2) White,6090,7190,15,"#5,923 in Home & Kitchen (See Top 100 in Home & Kitchen)  #12 in Microwave Ovens",01-10-2021,"IFB Industries Ltd.L-1, Verna, Goa, India-403722 0832-3044800/01 Customerservice@ifbglobal.com","IFB Industries Ltd.L-1, Verna, Goa, India-403722 0832-3044800/01 Customerservice@ifbglobal.com",B09HMGHFB6,4.3,3705,10 kg 800 g,35.5 x 25.9 x 44 Centimeters,1 Count,Microwave Ovens,IFB,20PM-MEC2,20,Countertop,Turntable,Convection,Black,230 Volts,1200 Watts,Stainless Steel,"Warranty Card, User Manual, Starter Kit",China
https://www.amazon.in/IFB-Convection-Microwave-30BRC2-Black/dp/B016ZLKJSU/ref=sr_1_10?qid=1686497015&s=kitchen&sr=1-10,"IFB 30 L Convection Microwave Oven (30BRC2, Black, With Starter Kit)",14990,19390,23,"#9,533 in Home & Kitchen (See Top 100 in Home & Kitchen)  #17 in Microwave Ovens",22-10-2015,"IFB Industries Ltd.L-1, Verna, Goa, India-403722 0832-3044800/01 Customerservice@ifbglobal.com","IFB Industries Ltd.L-1, Verna, Goa, India-403722 0832-3044800/01 Customerservice@ifbglobal.com",B016ZLKJSU,4.3,5310,9 kg 100 g,44 x 53.9 x 30 Centimeters,1 Count,Microwave Oven,IFB,30BRC2,30,Countertop,"101 Standard Menus, Various Cooking Mode, Convection Temperature (40~200 ), Preheat, Keep Warm, Auto Programs, Auto Cook, Sound on/off, Ceramic",Convection,Black,null,800 Watts,Other material,"1 Microwave Oven, Warranty Card, User Manual and Starter Kit",China
https://www.amazon.in/LG-Convection-Microwave-MC2846BV-Black/dp/B06XKC8S71/ref=sr_1_11?qid=1686497015&s=kitchen&sr=1-11,"LG 28 L Convection Microwave Oven (MC2846BV, Black)",11990,16999,29,"#4,823 in Home & Kitchen (See Top 100 in Home & Kitchen)  #8 in Microwave Ovens",14-03-2017,null,null,B06XKC8S71,4.4,2574,20 kg 600 g,42.5 x 23.5 x 41 Centimeters,null,Microwave Oven,LG,MC2846BV,28,Countertop,Touch Panel,Convection,Black,null,null,null,null,India
https://www.amazon.in/Bajaj-Microwave-1701-MT-White/dp/B00F15AFPY/ref=sr_1_12?qid=1686497015&s=kitchen&sr=1-12,"Bajaj 1701 MT 17L Solo Microwave Oven, White",4899,6299,22,"#2,741 in Home & Kitchen (See Top 100 in Home & Kitchen)  #5 in Microwave Ovens",07-09-2013,Bajaj,Bajaj,B00F15AFPY,4.3,5275,2 kg 490 g,110.2 x 158.3 x 83.5 Centimeters,1 set,Solo Microwave,Bajaj,1701 MT,17,Countertop,Autocook,Solo,White,null,800 Watts,null,1,China
https://www.amazon.in/IFB-Convection-Microwave-30BC5-IFBJ0/dp/B08NQJVWGQ/ref=sr_1_13?qid=1686497015&s=kitchen&sr=1-13,"IFB 30 L Convection Microwave Oven (30BC5, Black, With Starter Kit)",16800,18190,8,"#8,502 in Home & Kitchen (See Top 100 in Home & Kitchen)  #13 in Microwave Ovens",17-11-2020,"IFB Industries, Verna Industrial Estate, Goa - 403722","IFB Industries, Verna Industrial Estate, Goa - 403722",B08NQJVWGQ,4.3,202,12 kg,44 x 60 x 30 Centimeters,1 Count,Microwave Ovens,IFB,30BC5,30,Countertop,"101 Auto Cook Menus, Steam Clean, Disinfect, Deodorize, Timer option, Digital Clock, Power Save, Overheating Protection, Sensor Malfunction Protection",Convection,Black,230 Volts,800 Watts,"Stainless Steel, Glass","1 Microwave Oven, Warranty Card, User Manual and Starter Kit",India
https://www.amazon.in/IFB-Convection-Microwave-20SC2-Metallic/dp/B00A7PGI18/ref=sr_1_14?qid=1686497015&s=kitchen&sr=1-14,"IFB 20 L Convection Microwave Oven (20SC2, Metallic Silver, With Starter Kit)",10690,11490,26,"#8,980 in Home & Kitchen (See Top 100 in Home & Kitchen)  #15 in Microwave Ovens",15-11-2012,"IFB Industries Ltd.L-1, Verna, Goa, India-403722 0832-3044800/01 Customerservice@ifbglobal.com","IFB Industries Ltd.L-1, Verna, Goa, India-403722 0832-3044800/01 Customerservice@ifbglobal.com",B00A7PGI18,4.3,4884,15 kg 100 g,39 x 45.2 x 26.2 Centimeters,1 Count,Microwave Oven,IFB,20SC2,20,Countertop,Autocook,Convection,Silver,230 Volts,800 Watts,null,"1 Microwave Oven, Warranty Card, User Manual and Starter Kit",null
https://www.amazon.in/Panasonic-Convection-Microwave-NN-CT353BFDG-Mirror/dp/B00KPSSPZY/ref=sr_1_15?qid=1686497015&s=kitchen&sr=1-15,"Panasonic 23L Convection Microwave Oven(NN-CT353BFDG,Black Mirror, 360° Heat Wrap, Magic Grill)",10290,14990,31,"#15,006 in Home & Kitchen (See Top 100 in Home & Kitchen)  #26 in Microwave Ovens",02-06-2014,Panasonic,Panasonic,B00KPSSPZY,4.5,1428,2 kg 630 g,190 x 115 x 135 Centimeters,1 set,null,Panasonic,NN-CT353BFDG,23,Countertop,Autocook,Convection,Black,null,800 Watts,null,1,Thailand
https://www.amazon.in/IFB-Convection-Microwave-30FRC2-Pattern/dp/B016XZP3DY/ref=sr_1_16?qid=1686497015&s=kitchen&sr=1-16,"IFB 30 L Convection Microwave Oven (30FRC2, Floral Pattern & Black, With Starter Kit)",15490,20990,26,"#10,952 in Home & Kitchen (See Top 100 in Home & Kitchen)  #22 in Microwave Ovens",21-10-2015,"IFB Industries Ltd.L-1, Verna, Goa, India-403722 0832-3044800/01 Customerservice@ifbglobal.com","IFB Industries Ltd.L-1, Verna, Goa, India-403722 0832-3044800/01 Customerservice@ifbglobal.com",B016XZP3DY,4.4,2822,19 kg 300 g,44 x 53.9 x 30 Centimeters,1 Count,Microwave Oven,IFB,30FRC2,30,Countertop,"101 Auto Cook Menus, Steam Clean, Disinfect, Deodorize, Timer option, Digital Clock, Power Save, Keep Warm, Overheating Protection, Sensor Malfunction Protection",Convection,Black,230 Volts,800 Watts,Metal,"1 Microwave Oven, Warranty Card, User Manual and Starter Kit",China
https://www.amazon.in/Morphy-Richards-Convection-Microwave-30MCGR/dp/B008P7J5X8/ref=sr_1_17?qid=1686497015&s=kitchen&sr=1-17,"Morphy Richards 30 MCGR Deluxe 30L Convection Microwave Oven with Motorised Rotisserie, 200 Autocook Menus and Child Lock Feature, Black",10990,19595,44,"#15,777 in Home & Kitchen (See Top 100 in Home & Kitchen)  #29 in Microwave Ovens",26-07-2012,Morphy Richards,Morphy Richards,B008P7J5X8,4.2,239,12 kg 100 g,18.5 x 17.5 x 10.8 Centimeters,1 set,null,Morphy Richards,30MCGR,30,Countertop,Touch Panel,Convection,Black,230 Volts,1450 Watts,null,"Convection microwave, Rotisserie set, Instruction manual, Wire rack, Baking plate, Customer care list and Warranty card",China
https://www.amazon.in/IFB-Grill-Microwave-20PG4S-Silver/dp/B015AAV3PA/ref=sr_1_18?qid=1686497015&s=kitchen&sr=1-18,"IFB 20 L Grill Microwave Oven (20PG4S, Black & Silver, With Starter Kit)",7950,10590,25,"#9,753 in Home & Kitchen (See Top 100 in Home & Kitchen)  #18 in Microwave Ovens",12-09-2015,"IFB Industries, Verna Industrial Estate, Goa - 403722","IFB Industries, Verna Industrial Estate, Goa - 403722",B015AAV3PA,4.2,499,13 kg 300 g,39.1 x 45.2 x 26.2 Centimeters,1 Count,Microwave Ovens,IFB,20PG4S,20,Countertop,"61 auto-cook menu options, express cooking, auto reheat and deodorize, weight defrost, steam clean and multi stage",Grill,Black,null,800 Watts,Others,"1 Microwave Oven, Warranty Card, User Manual and Starter Kit",China
https://www.amazon.in/IFB-Litre-Microwave-20PM-MEC2B-Mechanical/dp/B09SF79M6Q/ref=sr_1_19?qid=1686497015&s=kitchen&sr=1-19,"IFB 20 Litre Solo Microwave Oven (20PM-MEC2B, Mechanical Knob,Black)",6240,7290,14,"#21,592 in Home & Kitchen (See Top 100 in Home & Kitchen)  #35 in Microwave Ovens",09-02-2022,"IFB Industries Ltd , 14 Taratola Road, Kolkata, India","IFB Industries, Verna Industrial Estate, Goa - 403722",B09SF79M6Q,4.2,138,8 kg,36.5 x 45.2 x 26.2 Centimeters,1 count,Solo Microwave Oven,IFB,IFB 20PM-MEC2B,20,Countertop,"Anti bacterial cavity, Auto Defrost, Overheating Protection, Timer Option",null,Black,230 Volts,1200 Watts,Stainless Steel,"1 Microwave Oven, Warranty Card, User Manual and Starter Kit",China
https://www.amazon.in/LG-Convection-Microwave-MC3286BRUM-Black/dp/B01LWE0QJK/ref=sr_1_20?qid=1686497015&s=kitchen&sr=1-20,"LG 32 L Convection Microwave Oven (MC3286BRUM, Black)",16999,23999,29,"#9,812 in Home & Kitchen (See Top 100 in Home & Kitchen)  #19 in Microwave Ovens",09-09-2016,null,null,B01LWE0QJK,4.4,2257,22 kg 600 g,53 x 31.5 x 52 Centimeters,null,Microwave Oven,LG,MC3286BRUM,32,Countertop,"Programmable, Autocook, Controlpanellock, Defrost, Interiorlight, Self-cleaning, Timer, Turntable",Convection,Black,230 Volts,2500 Watts,ABS,"Microwave oven, Owner's manual, Recipe manual, Cook book, Shelf, Milk container, Rotisserie bar and handle, Glass tray and tawa and Rotating ring",null
https://www.amazon.in/LG-Charcoal-Convection-Microwave-MJEN286UI/dp/B0B4Z2N3V9/ref=sr_1_21?qid=1686497015&s=kitchen&sr=1-21,"LG 28 L Charcoal Convection All In One Microwave Oven (MJEN286UI, Black, Healthy Heart Auto Cook Menu)",17990,25499,29,"#11,359 in Home & Kitchen (See Top 100 in Home & Kitchen)  #23 in Microwave Ovens",23-06-2022,"LG Electronics India Pvt. Ltd., 51, Udyog Vihar, Greater Noida (U.P)-201306 | E-Mail: serviceindia@lge.com | TEL (TOLL FREE) : 1800-315-9999, WhatsApp : 9711709999","A-24/6, Mohan Cooperative Industrial Estate, Mathura Road, New Delhi-110044",B0B4Z2N3V9,4.2,59,19 kg 400 g,48.8 x 51.2 x 31.1 Centimeters,1 Piece,Convection Microwave Oven,LG,MJEN286UI,28,Countertop,"Auto Cook, Defrost, Turntable, Racks, Steam clean",Convection,Black,230 Volts,1950 Watts,"Stainless Steel, Glass","Microwave Oven: 1U, Glass Tray: 1U, Rotating Ring 1U, Owner’s Manual: 1U",null
https://www.amazon.in/LG-Charcoal-Convection-Microwave-MJEN326PK/dp/B0816YMD45/ref=sr_1_22?qid=1686497015&s=kitchen&sr=1-22,"LG 32 L All in One Charcoal Convection Microwave Oven (MJEN326PK, Black)",22990,30990,26,"#9,043 in Home & Kitchen (See Top 100 in Home & Kitchen)  #16 in Microwave Ovens",07-11-2019,LG Electronics India Pvt. Ltd.,LG Electronics India Pvt. Ltd.,B0816YMD45,4.2,652,4 kg 780 g,2.05 x 2.09 x 1.27 Meters,1 set,Microwave Ovens,LG,MJEN326PK,32,Freestanding,"Programmable, Autocook, Controlpanellock, Defrost, Interiorlight, Self-cleaning, Timer, Turntable",Convection,Black Floral,230 Volts,2400 Watts,Stainless Steel,1,India
https://www.amazon.in/Bajaj-Grill-Microwave-MTBX-2016/dp/B072KZ373J/ref=sr_1_23?qid=1686497015&s=kitchen&sr=1-23,"Bajaj MTBX 2016 20L Grill Microwave Oven, Black",5699,7775,27,"#15,927 in Home & Kitchen (See Top 100 in Home & Kitchen)  #30 in Microwave Ovens",28-04-2017,"Imported and Marketed by Bajaj Electricals Ltd 45/47, Veer Nariman Road, Mumbai, 400001",Bajaj Electricals Ltd,B072KZ373J,4.3,2339,11 kg 300 g,20.9 x 15.7 x 12.9 Centimeters,1 set,null,Bajaj,MTBX 2016,20,Countertop,Autocook,"Grill, Microwave",Black,null,800 Watts,Powder Coated Iron,Microwave oven,null
https://www.amazon.in/Samsung-Convection-Microwave-MC32A7035CT-TL/dp/B09RB1DDZ2/ref=sr_1_24?qid=1686497015&s=kitchen&sr=1-24,"Samsung 32 L Convection Microwave Oven (MC32A7035CT/TL, Neo stainless silver, SlimFry)",16990,20000,15,"#22,805 in Home & Kitchen (See Top 100 in Home & Kitchen)  #36 in Microwave Ovens",27-01-2022,"Samsun Electronics (M) SDN BHD LOT 2, North Klang Straits, Area 21, Industrial Park, 42000 Port Klang, Selangor Darul, Ehsan, West Malaysia, Email : support.india@samsung.com Tel (Toll Free): 1800 40 7267864 (1800 40 SAMSUNG","Samsung India Electronics Pvt. Ltd., 6th Floor, DLF Centre, Sansad Marg, New Delhi - 110001 Email : support.india@samsung.com Tel (Toll Free): 1800 40 7267864 (1800 40 SAMSUNG)",B09RB1DDZ2,4.4,1614,20 kg,50.6 x 52.3 x 30.9 Centimeters,1 Case,Convection Microwave Oven,Samsung,MC32A7035CT/TL,32,Countertop,Auto Cook,Convection,Silver,230 Volts,900 Watts,Stainless Steel,"Quick Guide Label, Glass Turntable, Wire Rack, Crusty Plate",Malaysia
https://www.amazon.in/LG-Grill-Microwave-MH2044DB-Black/dp/B00R5QNW8E/ref=sr_1_25?qid=1686497015&s=kitchen&sr=1-25,"LG 20 L Grill Microwave Oven (MH2044DB, Black)",7790,10199,24,"#8,622 in Home & Kitchen (See Top 100 in Home & Kitchen)  #14 in Microwave Ovens",18-12-2014,LG,LG,B00R5QNW8E,4.3,636,3 kg,133.9 x 179.1 x 181.1 Centimeters,1 set,Microwave Oven,LG,MH2044DB.DB1QILN,20,Countertop,"Programmable, Autocook, Turntable , Interiorlight, Racks, Timer, Controlpanellock , Defrost, Self-cleaning, Turntable",Grill,Black,null,2000 Watts,Metal,1,null
https://www.amazon.in/sspa/click?ie=UTF8&spc=MTo1Mjc2MDc3ODgzNjMxMDk1OjE2ODY0OTcwMTc6c3BfYXRmX2Jyb3dzZToyMDEyMjM1NzkwODA5ODo6MDo6&url=%2FSamsung-Convection-Microwave-CE1041DSB3-TL%2Fdp%2FB09VH1Q7CM%2Fref%3Dsr_1_25_sspa%3Fqid%3D1686497017%26s%3Dkitchen%26sr%3D1-25-spons%26sp_csd%3Dd2lkZ2V0TmFtZT1zcF9hdGZfYnJvd3Nl%26psc%3D1,"Samsung 28 L Convection Microwave Oven (CE1041DSB3/TL, Black, SlimFry)",12390,16990,27,"#4,031 in Home & Kitchen (See Top 100 in Home & Kitchen)  #7 in Microwave Ovens",14-03-2022,Email: support.india@samsung.com Tel (Toll Free): 1800 40 7267864 (1800 40 SAMSUNG),Email: support.india@samsung.com Tel (Toll Free): 1800 40 7267864 (1800 40 SAMSUNG),B09VH1Q7CM,4.4,7758,17 kg 500 g,47.5 x 51.7 x 31 Centimeters,1 Case,Convection Microwave Oven,Samsung,CE1041DSB3/TL,28,Freestanding,Defrost,"Grill, Microwave, Convection",Black,230 Volts,900 Watts,"Cavity : Ceramic Enamel Cavity, Door : Glass, Body : Stainless Steel","Glass Turntable, Wire Rack, Crusty Plate, Quick Guide Label",Malaysia
https://www.amazon.in/LG-Convection-Microwave-MC2846SL-Silver/dp/B01JEKO1WY/ref=sr_1_26?qid=1686497017&s=kitchen&sr=1-26,"LG 28 L Convection Microwave Oven (MC2846SL, Silver)",11990,17699,32,"#35,212 in Home & Kitchen (See Top 100 in Home & Kitchen)  #41 in Microwave Ovens",30-07-2016,"LG Electronics, Udyog Vihar, Surajpur Kasna Road 201306| serviceindia@lge.com | TEL (TOLL FREE) : 1800 315 9999 / 1800 180 9999","LG Electronics, Udyog Vihar, Surajpur Kasna Road 201306| serviceindia@lge.com | TEL (TOLL FREE) : 1800 315 9999 / 1800 180 9999",B01JEKO1WY,4.3,1671,17 kg 800 g,49.5 x 51 x 30.5 Centimeters,1 count,Microwave Oven,LG,MC2846SL,28,Countertop,"Programmable, Autocook, Controlpanellock, Defrost, Interiorlight, Self-cleaning, Timer, Turntable",Convection,Silver,null,1950 Watts,ABS,"Also included in the box: 1 Microwave Oven, 1 Glass Tray, 1 Rotating Ring, 1 Owner Manual, 1 Recipe Manual, 1 Cook Book",India
https://www.amazon.in/LG-Convection-Microwave-MC2146BV-Black/dp/B06XK8RY1Q/ref=sr_1_27?qid=1686497017&s=kitchen&sr=1-27,"LG 21 L Convection Microwave Oven (MC2146BV, Black)",10390,14499,28,"#12,863 in Home & Kitchen (See Top 100 in Home & Kitchen)  #24 in Microwave Ovens",14-03-2017,"Packer Name ltd., Street No. 24/4, New Delhi, India - 110011, Contact: +91-221-000-2400, service@packer.com",null,B06XK8RY1Q,4.4,899,18 kg 600 g,46 x 25.5 x 44.5 Centimeters,1 count,Microwave Ovens,LG,MC2146BV.DBKQILN,21,Countertop,"Programmable, Autocook, Defrost, Interiorlight, Timer,Turntable, Controlpanellock, Self-cleaning,",Convection,Black,null,1860 Watts,null,"21L Capacity: Suitable for bachelors or small families;Convection: Can be used for baking along with grilling, reheating, defrosting and cooking;Warranty: 1 year on product;Brand does NOT provide starter kit with this product;151 auto cook;Qaurtz heater",India
https://www.amazon.in/LG-Charcoal-Convection-Microwave-MJ2887BFUM/dp/B09M7DH9LJ/ref=sr_1_28?qid=1686497017&s=kitchen&sr=1-28,"LG 28 L Charcoal Convection Microwave Oven (MJ2887BFUM, Black)",18590,19807,6,"#65,760 in Home & Kitchen (See Top 100 in Home & Kitchen)  #52 in Microwave Ovens",18-11-2021,"LG Electronics India Pvt. Ltd., LG Electronics, Udyog Vihar, Surajpur Kasna Road-201306, LG Electronics India Pvt. Ltd., LG Electronics, Udyog Vihar, Surajpur Kasna Road 201306| serviceindia@lge.com | TEL (TOLL FREE) : 1800 315 9999 / 1800 180 9999","A-24/6, Mohan Cooperative Ind. Estate, Mathura Road, New Delhi-110044",B09M7DH9LJ,4.4,2751,18 kg 800 g,51 x 51 x 30.5 Centimeters,1 Piece,Convection Microwave Oven,LG,MJ2887BFUM,28,Countertop,"Auto Cook, Timer, Defrost, Turntable, Steam clean",Convection,Black,230 Volts,900 Watts,"Stainless Steel, Glass",1U Microwave Oven; 1U Glass Tray; 1U Rotating Ring; 1U Owner’s Manual,India
https://www.amazon.in/LG-Charcoal-Convection-Microwave-MJEN326SF/dp/B07XZ1BW5P/ref=sr_1_29?qid=1686497017&s=kitchen&sr=1-29,"LG 32 L Charcoal Convection Microwave Oven (MJEN326SF, Black)",31990,32990,3,"#135,975 in Home & Kitchen (See Top 100 in Home & Kitchen)  #70 in Microwave Ovens",17-09-2019,"LG Electronics, Udyog Vihar, Surajpur Kasna Road 201306| serviceindia@lge.com | TEL (TOLL FREE) : 1800 315 9999 / 1800 180 9999","LG ELECTRONICS, PLOT NO. A-5, M.I.D.C RANJANGAON, TAL SHIRUR ,PUNE--412220 RANJANGAON -412220 Maharashtra | TEL (TOLL FREE) : 1800 315 9999 / 1800 180 9999 | serviceindia@lge.com",B07XZ1BW5P,4.4,235,81 kg,64 x 60 x 85 Centimeters,1 count,Microwave Ovens,LG,MJEN326SF,32,Freestanding,"Programmable, Autocook, Controlpanellock, Defrost, Interiorlight, Self-cleaning, Timer, Turntable",Convection,Black,230 Volts,2400 Watts,Stainless Steel,"1 unit of machine, 1 unit of drain hose, 1 unit OT hose, 1 unit of QRG, 1 unit of user manual",India
https://www.amazon.in/Voltas-Beko-Convection-Microwave-MC28BD/dp/B07NHVP6KW/ref=sr_1_30?qid=1686497017&s=kitchen&sr=1-30,"Voltas Beko 28 L Convection Microwave Oven, 5 power levels (MC28BD, Black)",10590,19990,47,"#117,239 in Home & Kitchen (See Top 100 in Home & Kitchen)  #61 in Microwave Ovens",08-02-2019,(Deemed) Voltbek Home Appliances Pvt. Ltd. Voltas House A Chinchpokli Mumbai-400033 Contact: 1860 599 4444,Voltbek Home Appliances Pvt. Ltd. Voltas House A Chinchpokli Mumbai-400033 Contact: 1860 599 4444,B07NHVP6KW,4.2,20,13 kg 700 g,41 x 48.5 x 29.2 Centimeters,1 Units,Microwave,Voltas Beko,MC28BD,28,Freestanding,"Digital Display, Large Turntable and 5 power levels, Voltas microwave comes with Auto Cooking, Active Defrosting",Convection,Inox,230 Volts,900 Watts,Stainless Steel,"Microwave Oven , User Manual , Glass Tray , Roller Ring,Griller , Power Cable",China
https://www.amazon.in/Haier-Convection-Microwave-HIL2501CBSH-HAL2WBlack/dp/B0861SL97J/ref=sr_1_31?qid=1686497017&s=kitchen&sr=1-31,"Haier 25 L Convection Microwave Oven (HIL2501CBSH, HAL2WBlack)",12499,18999,34,"#286,803 in Home & Kitchen (See Top 100 in Home & Kitchen)  #118 in Microwave Ovens",17-03-2020,null,null,B0861SL97J,4.3,50,18 kg,50 x 51.2 x 30.5 Centimeters,null,Microwave Ovens,Haier,HIL2501CBSH,25,Countertop,"Child Lock Available, Turntable",Convection,Black,230 Volts,null,Iron,"1 Set ( Include Glass Turntable, roller ring and coupler), 1 user manual & Warranty card",India
